{
  "schema_version": "1",
  "project": "mi",
  "change": "first-release-acceptance-closure",
  "commit_sha": "d11352c92ea3cf6043582e1188658dc17eb30659",
  "test_type": "integration",
  "status": "passed",
  "started_at": "2026-04-28T05:50:19Z",
  "finished_at": "2026-04-28T05:50:20Z",
  "source": {
    "kind": "local",
    "workflow": "integration",
    "run_id": "local"
  },
  "stats": {
    "total": 620,
    "passed": 620,
    "failed": 0,
    "skipped": 0
  },
  "artifacts": []
}
