{
  "schema_version": "1",
  "project": "mi",
  "change": "legacy-system-migration",
  "commit_sha": "7777777777777777777777777777777777777777",
  "test_type": "integration",
  "status": "passed",
  "started_at": "2026-03-30T10:00:00Z",
  "finished_at": "2026-03-30T10:01:00Z",
  "source": {
    "kind": "self-test",
    "workflow": "fixture-type-mismatch",
    "run_id": "fixture-11"
  },
  "stats": {
    "total": 2,
    "passed": 2,
    "failed": 0,
    "skipped": 0
  }
}
