{
  "schema_version": "1",
  "project": "mi",
  "change": "legacy-system-migration",
  "commit_sha": "2222222222222222222222222222222222222222",
  "test_type": "unit",
  "status": "passed",
  "started_at": "2026-03-30T10:00:00Z",
  "finished_at": "2026-03-30T10:01:00Z",
  "source": {
    "kind": "self-test",
    "workflow": "fixture-archive",
    "run_id": "fixture-3"
  },
  "stats": {
    "total": 10,
    "passed": 10,
    "failed": 0,
    "skipped": 0
  }
}
