{
  "schema_version": "1",
  "project": "mi",
  "change": "first-release-acceptance-closure",
  "commit_sha": "4fa94fe9f5a61f54fbc84bd51304bfb6e3a567c0",
  "test_type": "e2e",
  "status": "failed",
  "started_at": "2026-04-28T03:17:56Z",
  "finished_at": "2026-04-28T03:18:47Z",
  "source": {
    "kind": "local",
    "workflow": "e2e",
    "run_id": "local"
  },
  "stats": {
    "total": 46,
    "passed": 42,
    "failed": 4,
    "skipped": 0
  },
  "artifacts": [
    "frontend/test-results/e2e-results.json"
  ]
}
