{
  "schema_version": "1",
  "project": "mi",
  "change": "legacy-system-migration",
  "commit_sha": "bbbbbbbbbbbbbbbbbbbbbbbbbbbbbbbbbbbbbbbb",
  "test_type": "e2e",
  "status": "passed",
  "started_at": "2026-03-30T10:06:00Z",
  "finished_at": "2026-03-30T10:05:00Z",
  "source": {
    "kind": "self-test",
    "workflow": "fixture-time-reversed",
    "run_id": "fixture-24"
  },
  "stats": {
    "total": 3,
    "passed": 3,
    "failed": 0,
    "skipped": 0
  },
  "artifacts": [
    "frontend/test-results/e2e-results.json"
  ]
}
